<?xml version="1.0" encoding="UTF-8"?>
<actions xmlns="http://www.asseco-see.com.tr/schema-action-rules"
	xmlns:xsi="http://www.w3.org/2001/XMLSchema-instance"
	xsi:schemaLocation="http://www.asseco-see.com.tr/schema-action-rules xsd/schema-action-rules.xsd">
	<!-- Parameter definitions for API Actions. Order of parameters should be:
		required, conditional, optional. Make sure you XML validate this file before
		committing any changes -->

	<action name="api-request-param-definitions.xml">
		<params>
			<param name="ACTION" required="required" type="enum" enumClass="goprime.fictive.api.enums.ApiAction" maxLength="128" />
			<param name="EMAIL" required="conditional" type="string" maxLength="64" ifParamNotPresent="USERNAME"/>
			<param name="USERNAME" required="required" type="string"  maxLength="64" ifParamNotPresent="EMAIL"/>
			<param name="PASSWORD" required="required"  type="string" maxLength="64" />
		</params>
	</action>
	<action name="APIQUERYPROJECT">
		<param name="ACTION" required="required" type="enum" enumClass="goprime.fictive.api.enums.ApiAction" maxLength="128" />
		<param name="EMAIL" required="conditional" type="string" maxLength="64" ifParamNotPresent="USERNAME"/>
		<param name="USERNAME" required="required" type="string"  maxLength="64" ifParamNotPresent="EMAIL"/>
		<param name="PASSWORD" required="required"  type="string" maxLength="64" />
	</action>	
	</actions>